{
    "scenarioName": "For deserialize only",
    "ignoreStepFailures": true,
    "steps": [
        {
            "name": "step1",
            "url": "/anUrl/${0}/${1}",
            "operation": "GET",
            "request": {
                "queryParams": {
                    "id1": "${PARAM.id}",
                    "id2": "${PARAM.id}",
                    "addressId1": "${PARAM.AddressId}",
                    "addressId2": "${PARAM.AddressId}"
                }
            },
            "assertions": {
                "status": "${PARAM.status}"
            }
        }
    ],
    "parameterized": {
        "withHeaders": true,
        "csvSource": [
            "id,                  AddressId,              status",
            "${RANDOM.NUMBER},      ${RANDOM.NUMBER},           200",
            "11,                    22,                         400"
        ]
    }
}
